{
    "$schema": "../theme-schema.json",
    "name": "Minimal Theme",
    "description": "A clean, minimalist theme focused on content and readability",
    "version": "1.0.0",
    "author": "Charlie Etienne",
    "screenshot": "screenshot.png",
    "settings": {
        "primary_color": "#374151",
        "neutral_color": "gray",
        "heading_font": "Inter",
        "body_font": "Inter",
        "code_font": "JetBrains Mono",
        "dark_mode": "switcher"
    }
}
